<?xml version="1.0" encoding="UTF-8"?>
<entities
	xmlns="http://www.w3.org/2001/XMLSchema-instance"
    schemaLocation="xsd/entity-definition.xsd">
	<entity name="User" table-name="User">
		<field name="username" column-name="username" type="String" is-pk="true" not-null="true">
		</field>
		<field name="password" column-name="password" type="Password" is-pk="true" not-null="true">
		</field>
		<field name="firstName" column-name="firstName" type="String" not-null="true">
		</field>
		<field name="lastName" column-name="lastName" type="String" not-null="true">
		</field>
		<field name="comments" column-name="comments" type="String">
		</field>
		<field name="date" column-name="date" type="Date">
		</field>
		<field name="active" column-name="active" type="Boolean">
		</field>
		<field name="currency" column-name="currency" type="String">
		</field>
	</entity>
</entities>